key,inst-moment,title,nick,message,email,link
peep-01, 2023/01/03 21:02, peepCon, nick1, Este peep tiene todo, correoFalso@gmail.com, ev.us.es
peep-02, 2022/10/11 23:59, peepSinMail, nick2, Este peep no tiene email, null, ev.us.es
peep-03, 2022/10/12 00:00, peepSinLink, nick3, Este peep no tiene link, correoFalso@gmail.com, null
peep-04, 2022/12/31 21:48, peepSinNada, nick4, Este peep no tiene link ni email, null, null
peep-05, 2022/11/12 15:51, peepLink1, nick5, Este peep no tiene link, correoFalso@gmail.com, null
peep-06, 2022/19/12 13:27, peepSinMail1, nick6, Este peep no tiene email, null, ev.us.es
peep-06, 2022/05/12 15:24, peepCon, nick7, Este peep contiene un mensaje extremadamente largo pero sin pasarse, correoFalso@gmail.com, ev.us.es
peep-07, 2022/03/11 16:32, peepSímbolos, nick8, Este peep c0nt1en% #123 simbolos, null, null